{"assets":[{"asset_id":"asset-1","data_url":"data:image/png;base64,AA==","mime_type":"image/png","source":"/local/image.png"}],"css":".native-slide{background:#fff}","height":1080,"html":"<div class=\"native-slide\" data-page-id=\"../../escape\"><h1 data-motion-id=\"title\">标题</h1></div>","page_id":"../../escape","scene_manifest_sha256":"aaaaaaaaaaaaaaaaaaaaaaaaaaaaaaaaaaaaaaaaaaaaaaaaaaaaaaaaaaaaaaaa","schema_version":1,"warnings":[],"width":1920}